Manx,English,Page,Notes
"Dy bee oo booiagh lesh dty Chronney hene, myr shen ta oardyt dhyt liorish Jee creeney as Mie.","That you be contented with your own Lot, as that which is appointed you by a wise and good God.",94,
"[ 86 ] Er jerrey ooilley dy jean oo Jee y hoiagh kinjagh kiongoyrt rhyt, ta fakin eer folliaght dty Chree, as nee e dy chooilley haynt pheccoil t’ayn y cherraghey.","Lastly, that you set God always before you, who seeth the very Secrets of your Heart, and will punish all its sinful Lusts.",95,
" Yn PHADJER."," The PRAYER.",95,
"FOshtyl us nyn Sooillyn, O Hiarn dy vaik mad dy vel dty Leih Casherick, Cairagh as Mie as dy vod mad y reall eh lesh ooilley nyn Gree, dy vod mad ve graihagh as ammyssagh daue-syn ta’n Chiarralys flaunyssagh ayds er soiagh er nyn skyn ; Dy vod mad gyn tranlaase y yanoo er dooinney erbee ; Dy der mad feoh da dagh yearree, goo as obber niau-ghlen, da dy chooilley oalsaght as [91] chennid, da dy chooilley alkys1 ta cheet jeh chengey vreagagh, da dy chooilley yearree Sayntoil as toshiaght Saynt ny foalley. Hiarn jean myghyn orrin as scrieu ooilley dty Leiaghyn shoh ayns nyn Greeaghyn, ta shin dy feer injil guee ort. Amen.","OPen our Eyes, O Lord, that we may see that thy Law is Holy, Just, and good ; and that we may keep it with our whole Heart ; that we may love and honour all those whom thy Providence hath made our Betters. That we may do Violence to no Man. That we may abhor all Unchast Desires, Words, and Actions ; all Deceit and Oppression ; all the Evils of a lying Tongue ; all covetous Desires, and Beginnings of Lust. Lord have Mercy upon us, and write all these thy Laws in our Hearts, we most humbly beseech thee. Amen.",95,
Q. CRE smoo t’ow dy ynsagh liorish ny Annaghyn shoh ?,Q. WHAT dost thou chiefly learn by these Commandments ?,95,
"A. Ta mee gynsagh Da red, my Churrym gys Jee, as my Churrym gys my Naboo.","A. I learn two things, my Duty towards God, and my Duty towards my Neighbour.",95,
Q. Cre’n aght ta ny Annaghyn er nyn ren ?,Q. How are the Commandments divided ?,95,
"A. Ta’n chied keyr jannoo yn chied Ayrne as gynsagh dooin nyn gurrym gys Jee ; yn shey elley yn nagh Ayrne, Soiagh magh nyn gurrym gys nyn Naboo.","A. The Four first make the First Table, and teach us our Duty to God : The Six last, or the Second Table, do contain the Duty we owe to our Neighbour.",95,
[ 87 ] Q. Cree [sic] ta dty Currym [sic] gys Jee ?,Q. What is thy Duty towards God ?,96,
"A. Ta my Currym [sic] gys Jee, dy chredjal ayn dy ghoal Aggle roish, dy chur Graih da, lesh ooilley my Chree, lesh ooilley my aigney, lesh ooilley my Annym as lesh ooilley my Niart ; Dy chur ooashley da, dy chur booise da, dy chur my slane treshteil [92] ayn, dy eamagh er dy chur arrym da e ennym casherick as da e ghoo, as dy hirveish e dy firrinagh ooilley laghyn my Vea.","A. My Duty towards God, is to believe in him, to fear him, to love him, with all my Heart, with all my Mind, will all my Soul, and with all my Strength ; to worship him, to give him Thanks, to put my whole Trust in him, to call upon him, to honour his holy Name and his Word, and to serve him truly all the Days of my Life.",96,
Q. Vel Currym Creestee doillee dy ve er ny hoiggal ?,Q. Is a Christian’s Duty hard to be understood ?,96,
"A. Cha vel er aght erbee. Creesteeaght obber dy chooilley ghooinney, as foddee dooinney er beggan tushtey my ta cree onneragh echey, fys ve echey er e Churrym as foddee e yanoo eh, chammah as y Fer-ynsee smoo erbee.","A. By no means ; Religion being the Business of all Men ; a plain Man, if he is well-disposed, may know his Duty, and be able to perform it, as well as the greatest Scholar.",96,
Q. Ta’d shoh Goan feer gherjolagh dy der Jee tushtey dou jeu.,"Q. This is a comfortable Truth, I pray make me sensible of it.",96,
"A. Nagh vaik oo dy vel dy chooilley hushtey ymmyrchagh Soit shees ayns focklyn giarrey. Ta dty Churrym gys Jee as gys dty Naboo scruit ayns beggan goan, feer ashagh dy vel er nyn doiggal as freilt ayns cooinaghtyn raad ta sleih dy firrinagh credjal ayns Jee as dy creeoil gearree dy ve Sauchey.","A. Do you not see that all necessary Knowledge lieth in a very narrow compass ; Your Duty to God, and to your Neighbour, is contained in a few Words, very easie to be understood and remembred, where People truly believe in God, and heartily desire to be saved.",96,
"Q. Eisht ta mish treshteil nagh bee’m callit, son ta mee credjal ayns Jee, as ta mee dy creeoil gearree dy ve sauchey.","Q. Then I trust I shall not perish, for I do believe in God, and I heartily wish to be saved.",96,
"A. Cha negin dhyt ve mollit ayns nee ta chooish lie er. Foddee nagh vel oo credjal ayn ny graihagh er Jee lesh oilley dty Chree, ga t’ow Smooinaght dy vel oo.","A. You must not be deceived in a Matter of so great Moment. It may be you do not believe in, nor fear, nor love God with all your Heart, though you are perswaded you do.",96,
"Q. Ve’n booiagh my vee-hushtey y akin, my ta mee er shaghryn.","Q. I beg I may see my Error, if I am in one.",97,
"A. Vel oo tannaghtyn ayns peccah erbee er fys dhyt ? My t’ow janoo shen foddee oo ve [93] shicker jeh nagh vel oo goal aggle roishyn, echey ta pooar dy stroie Corp as Annym ayns Nivrin.","A. Do you live in any known Sin ? If you do so, you may be sure you do not fear Him who hath Power to destroy both Body and Soul in Hell.",97,
"Foddee dy vel oo smooinaght dy vel graih ayd er Jee er skyn dy chooilley nee, agh mannagh vel oo kiarralagh dy reall e Leihaghyn, as corree rhyt hene, tra t’ow dyn mrishey ad, eisht cha vel graih ayd er Jee ; son shoh ta’n Noo Ean dy ghra, Graih Yee dy vel shin freall e Annaghyn.","It may be, you think, you love God above all Things, but if you are not concerned to keep his Laws, and angry with your self when you break them, then you do not love God : For this, saith S. John, is the love of God, that we keep his Commandments.",97,
"Vel oo roih gys Jee ayns ooilley dt’eme, guee huggey, booiagh lesh ny te gordrail er dy hon, tilgey ooilley dty chairrail er, mannagh vel oo janoo shen, cha vel oo treshteil ayn, lesh ooilley dty Chree.","Do you run to God in all your Wants, pray to him, rest satisfied with what he orders for you, casting all your Care upon him ? If you do not so, Why then you do not trust in Him with all your Heart ?",97,
"Q. Heeym dy nee my Churrym eh myr shoh dy chur graih da Jee, dy ghoal aggle roish, as dy Hreshteil ayn, agh te1 aggle orrym dy bee eh doillee dou shen y yanoo.","Q. I see it is my Duty thus to Love, and to Fear, and to Trust in God, but I am afraid it will be hard for me to do so.",97,
"A. Ny lig dty chree woid, gys yn Aigney ta soit er reddyn mie, ver grayse Yee er dy chooilley nee ve ashagh.","A. Be not discouraged ; to a well disposed Mind, the Grace of God will make every thing easie.",97,
"Agh ny Yei cooinee dy vel yn Aigney graysoil shoh dy ve er ny gheddyn chammah liorish dt’ymmyrkey hene as liorish cooney Yee. Nagh vel dooinney erbee cheet gys mooads e viys2 ec yn yn cheart, agh ta obber y Spyrryd dy cooiee er ny holagh gys greine dy rass Mustart, ga nagh vel eh hoshiaght agh fardalagh, ny yeih te dy gerrit gaase dy ve ny villey.","Only remember, that these gracious Dispositions are to be obtained as well by your own Endeavours, as by God’s Assistance. That no Man is perfect at once, but the Work of the Spirit is fitly compared unto a grain of Mustard-seed, which, though small at first, yet soon becomes a Tree.",97,
"Q. Cre shegin dou y yanoo dy vodym Credjal fegooish dooyt erbee, dy nee Jee ta reill dy [94] chooilley nee as dy vodym ve booiagh lesh cre erbee Te dy yanoo er my hon, son y chooid share ?","Q. What then must I do, that I may believe, without any doubt, that God governeth all things, and that I may cheerfully submit to whatever He doth, as the best ?",98,
"A. Shegin dhyt dy mennick smooinaght ayd hene nagh vod Jee aggair y yanoo da e Chreturyn hene, son cha beagh e er chroo ad, dy beagh feoh echey orroo.","A. You must often consider, that God cannot do Wrong to his Creatures, which he would not have made, if He had hated them.",98,
"Cooinee dy vel ny deney scrauee goal rish Cairys as miys Yee, dy jarroo tra te dyn gerragh ad.","Remember that the best Men do own the Justice and Goodness ness [sic] of God, even when they smart under his hand.",98,
"Smooinee er cre cha moall as ta dty hushtey, as myr honnick oo hoshiaght yn arroo tilgit ayns y talloo, ga dy rou eh ayns fakin dhyts tilgit er sooyl, ny yei cha voddagh oo agh smooinaght dy rou Resoon ocsyn ren eh, er y hon, son dy rou ad ny screeney ny uss, my nee oo smooinaght myr shoh jeh Jee, hig oo ec y jerrey dy ve feer vooiagh lesh ooilley ny te dy yanoo, ny surral dy ve jeant, as cha bee oo jummoogh jeh aghtyn y Chiarrail flaunysagh echey.","Consider how short your own Knowledge is ; and, as when you first saw Corn flung into the Ground, tho it did seem to you to be lost, yet you could not but think, they that did it had Reason for it, because they were wiser than you ; If you think so of God, you will at last come to be well pleased with whatever he doth, or permits to be done, and never to murmur at the Ways of His Providence.",98,
"Q. Ga dy nee my churrym dy ghoal aggle roish Jee er skyn dy chooilley nee, ny yeih ta mee dy mennick ny sagglee roish ny Leihaghyn as roish corree my Chargjin ny ta mee roish Jee.","Q. Though it is my Duty to fear God above all Things, yet I am often more afraid of the Laws, and the Anger of my Friends, than of God.",98,
"A. Agh cha bee oo myr shen my nee oo streeue dy reall ayns dty Chree, dy vel ny sooillyn echyssyn kinjagh or’t. Dy vel eh vriwnyssyn feer trome. Dy vel eh red aglagh gys Peccagh, dy hutchim fo’n jummoose echyssyn ren y chroo e. Smooinee dy mennick er shoh, as ynsee oo dy ve ny sagglee roish Jee ny roish y Vaase.","A. But you will not be so, if you strive to keep it in your Heart, That his Eyes are ever upon you ; That his Judgments are very terrible. That it is a fearful thing for a Sinner to fall under the Displeasure of his Maker. Think much of this, and you will learn to fear God more than Death.",98,
[95] Q. Cree’n1 aght shegin dou gynsagh dy chur graih da Jee ?,Q. How must I learn to Love God ?,99,
"A. Smooinee ayd hene cre’n aght haink oo dy ve graihagh er dt’Ayr as dty Voir ; nagh nee son dy rou cliaghtey dy roih huc er dy chooilley oyr, as hooar oo ad kinjagh arryltagh dy chlashtyn rhyt as dy chooney liat ?","A. Consider how you came to Love your Parents, was it not because you were used to go to them upon all Occasions, and found them always ready to hear and to help you ?",99,
"Nish jean smooinaght dy dowin nagh voddagh dt’Ayr as dty Voir cooney liat fegooish Bannaght Yee ; cha voddagh dty Voir ee hene y reall nagh beagh ee er ny livrey jeeds roish y tra, as tra rug oo cha voddagh ee oo y reall veih drogh haghyrtyn veih Chyngys ny veih Baase. Jee t’er dy choadey, ta dy dy chuirrey dy eamagh er ayns ooilley dt’eme ; t’er yialdyn dy chlashtyn, dy reggyrt oo, as dy ve ny Ayr dhyt, as my ver oo bialys da, nee e oo Bannit son dy bra.","Why, now consider that your Parents could not help you, without God’s Blessing ; your Mother could not hinder her self from Miscarrying of you, and when you were born, she could not keep you from sad Accidents, from Sickness, or from Death. It is God who hath preserved you, who inviteth you to call upon him in all your Wants, hath promised to hear, to answer, and to be a Father to you, and, if you obey Him, to make you happy for ever.",99,
"Vel oo er-y-fa shoh soiagh jeh[’]n Cuirrey grasoil shoh, jean padjer gys Jee son ny tow dy laccal as ver oo graih da, cha dooghyssagh as ta liannoo dy chur da y Voir ta dy hroggal e.","Do you therefore accept of this gracious Invitation, pray to God for what you want, and you will love Him as naturally as a Child doth the Parents that nourish him.",99,
"Q. Agh ga dy nee my Churrym eh, dy eamagh er Jee as dy chur ooashley da, ny yeih ta mee gennaghtyn niau-arryltys ayns my ghooghys dy yanoo myr shen.","Q. But, though it is my Duty to call upon, and worship God, yet I find a backwardness in my Nature to do so.",99,
"A. Foddee shen y ve, ny yei jean red ennagh noi dty ghooghys ; Freill dty Chree glen, as smooinee er dty laa jerrinagh as Guee kinjagh son ooilley dty niau-arryltys as dty Chliaghtey, as ny1 grayse Yee shen yn eunys ad,2 ta nish ny errey dhyt.","A. That may be. However, do something against your Inclinations ; keep your Heart clean, and your Thoughts upon your latter End, and pray constantly, notwithstanding your Unwillingness and Custom, and the Grace of God will make that a Delight, which is now a Burthen.",99,
"[96] Q. Ta fys aym dy vel resoon aym dy chur booise da Jee, as fooast cha vel taitnys mooar ayns my chree gys e Vannaghtyn.","Q. I know I have Reason to give God thanks, and yet, my Heart is not much affected with his Blessings.",100,
"A. Shen-y-fa shegin dhyt dy mennick smooinaght er e Yiootyn, as tra t’ow geddyn bannaght erbee, chyndaa dty smooinaght chelleeragh gys Jee as abber, Ta’n vyghyn shoh veihsyn, she eshyn ta cur carjin dou, eshyn ta dy my chur er my hoshaght ayns y raad ta mee shooyl ; She Jee t’er chur my laynt dou reeisht ; She eshyn ta cur m’aash dou dy chooilley oiee lesh cadley, as ta dy my choadey dagh laa veih gaue. Jean shoh as ver oo booise da cha dooghyssagh as hirrys oo e Vannaghtyn.","A. Therefore you must often think of his Favours, and when you receive any Blessing, turn your Thoughts forthwith towards God, and say, This Mercy is from Him ; It is He that gives me Friends ; It is He that prospers me in the Way I go ; It is God who hath restored me to Health ; It is He that refreshes me every Night with Sleep, and every Day preserveth me from Danger. Do this, and you will as naturally return Him Thanks, as desire his Blessings.",100,
"Q. Ta fys aym dy nee my churrym eh, Dy chur my lane Treshteil ayns Jee, agh voddym shoh yanoo tra te liggey dou tutchim ayns seaghyn ?","Q. I see it is my Duty To put my whole Trust in God ; but is it possible for me to do so, when he suffers me fall into Affliction ?",100,
"A. Foddee dy jarroo. As ta sleih mie reau er yanoo shen. Ga dy mar e mee, ny yei treishtym ayn, dooyrt Job.","A. Yes sure. Good Men have always done so. Though he slay me, yet will I Trust in him, saith Job.",100,
"Cooinee dy vel eh mie dy ve ayns seaghyn, tra hee Jee eh ymmyrchagh, er aght elley cha vel boggey echey ayns trimshey e chreturyn.","Remember, that it is good to be in trouble, when God sees meet, who otherwise doth not delight in the Miseries of his Creatures.",100,
Q. Cre ta my Churrym tra ta Jee lie e laue orrym ?,Q. What will be my Duty when God shall visit me ?,100,
"A. Dty Churrym eh, dy ve Surransagh, dy vriwnys dty raadjin, as dy hyndaa chelleeragh gys Jee, as dy ghuee dy jean e liorish Seaghyn y Vea shoh dy hayrn gys Bea share, as cur tooai nagh shirroo son cooney veih’n Jouyl, myr t’adsyn [97] ta cliaghtey er Oallyssyn, tra ta’d hene ny nyn gooid ayns feme.","A. It will be your Duty to be patient, to consider your Ways, and to turn to God immediately, and pray that he may make the Troubles of this Life a means of bringing you to a better ; and beware of seeking Help from the Devil, as they do, who make use of Charms, when they, or their Goods are in Distress.",100,
"Q. Negin dou neesht treshteil ayns Jee, as Credjal dy vel e kiarralagh jeem tra ta mee ayns Boughtinid ?","Q. Must I also trust in God, and believe that he careth for me, though I am in Poverty ?",101,
"A. Shegin dhyt. Son cha vel Berchys kinjagh courey jeh Foar Yee, ny Boughtynnid jeh e ymmoose.","A. You must do so. For Riches are not always a Sign of God’s Favour, nor Poverty of His Displeasure.",101,
"Cooinee er cre’n brearrey hug Jacob, My vees Jee marym as my ver e arran dou dy ee, as Coamrey dou dy chur Moom, Eisht bee[’]n Chiarn y Jee aym.","Remember the Resolution which Jacob made, If God will be with me, and give me Bread to eat, and Raiment to put on, then shall the Lord be my God.",101,
"Son gerjagh dhyt hene as dy niartagh dty credjue, gou ayd hene, dy nee obber Yee shoh, dy vod e liasagh fondagh y chur dhyt ayns y teihl ta ry heet son ny t’ow dy ymmyrch ayns shoh.","To comfort your self and confirm your Faith, consider, That this is the Work of God. That he can make you sufficient amends in the next World, for what you want in this.",101,
Dy vel ny Boughtyn er nyn enmys dy ve Eiraghyn y Reeriaght echyssyn.,That the Poor are expressly declared to be Heirs of his Kingdom.,101,
Dy vel dy jarroo Sooyllyn Yee kinjagh er y Vought ; son dy vel e cha mennick er sarey feallagh elley dy ghoal kiarrail jeh.,"That to be sure, God hath his Eye continually upon the Poor, because he hath so often commanded others to take Care of them.",101,
"Smooinee er ny reddyn shoh as bee oo booiagh lesh y stayd t’ow ayn, as cha shir oo y yanoo ny share eh, liorish aghtyn aggairagh.","Think of these Things and you will be content with your Condition, and not desire to better it by unjust Ways.",101,
Cha jean oo troo mish ny Berchee ny foill y gheddyn da Miys Jee.,"You will neither envy the Rich, nor question the Goodness of God.",101,
Q. Vel ny Berchee chooish kainlt dy Hreshteil ayns Jee as ta ny Boughtyn ?,"Q. Are the rich as much bound to Trust in God, as the Poor ?",101,
A. Ta. Son gys Jee ta’d cur nyn marrant dy jean nyn merchys mie daue as dy jean ad fuirraght oc. Son ta Berchys janoo Skeanyn daue hene as getlagh er sooyl. As Jee ta cur pooar da [98] dooinney dy ghoal solley jeh ny te er gheddyn.,"A. They are. For they depend upon God, both for the Enjoyment, and Continuance of their Riches. For Riches make themselves Wings, and fly away. And it is God who giveth a Man Power to enjoy what he has gotten.",101,
"As shen-y-fa ta Berchee er nyn sarey gyn ve ard-aignagh, ny treshteil gys berchys niau-hicker, agh ayns y Jee bio.","And therefore rich Men are commanded, Not to be highminded, not to Trust in uncertain Riches, but in the Living God.",102,
"Dy chur ayrn jeh nyn gooid da ny Boughtyn myr feeaghyn ta cair daue. Dy ve booisal as gyn nyn marail ad, er nyn aignaghyn Sayntoil.","To give of their Substance to the Poor, as a Debt due to him. To be thankful, and not to spend them upon their Lusts.",102,
"Q. My churrym dy chur ooashley da Ennym casherick Yee as da ghoo, Cre’n aght nee’m shen ?","Q. It is my Duty [to] honour God’s holy Name and his Word, How shall I bring my self to do so ?",102,
A. Cur tooai nagh loar oo jeh Jee agh tra t’ow dy jarroo smooinaght er. Cooinee dy mennick dy vel e dy dt’akin as myr shen bee oo agyndaghdy yanoo shen smoo vees gys Ooashley yn ennym echyssyn.,"A. Take Care not to speak of God,  but when you are serious. Consider often that He seeth you, and so you will beapt to do what is most for the Honour of his Name.",102,
"As my nee oo dy mennick cooinaght dy vel Jee er livrey dooin Lioar y ghoo hene dy ynsagh shin cre liasagh shin y Chredjal as cre’n aght lishagh shin Beaghey dy gheddyn Maynrys vees dy bragh farraghtyn, as dy vel dty haualtys lie er, tushtey ve ayd jeh ny t’ayns y Lioar shen. Cre erbee’n tra t’ow dy lhaih ee ny clashtyn ee Lhaihit, eashtee oo ree dy imnea-agh shirree oo geirt er y choyrle ti-ee dy chur dhyt, cha jig oo harrish ayrn erbee jee, agh gys ymmydyn creeney as crauee. As myr shen bee arrey ayd ayn, as ver oo Onnor da y Ghoo casherick.","And if you often remember, that the Bible is a Book given by God, to teach us what we are to Believe, and how we are to Live, that we may attain eternal Happiness ; And that your Salvation depends upon knowing what that Book containeth : When ever you read, or hear it read, you will attend to it carefully, endeavour to follow the Directions it gives you, never repeat any Part of it, but to Serious and Holy Purpose, and so you will delight in, and honour His Holy Word.",102,
Q. My Churrym eh dy hirveish e dy firrinagh ooilley laghyn my Vea. Agh nagh jeann [99] obbraghyn ymmyrchagh my liettal veih chooish y yanoo as t’er ny hirrey orrym ?,Q. It is my Duty to serve Him truly all the Days of my Life. But will not necessary Business hinder me from doing so much as is required of me ?,102,
"A. Cha jean. Foddee cre erbee ta Jee dy herrey1 er dooinney erbee y yanoo, ve jeant, fegooish e obbraghyn Seihltagh y liggey shaghey.","A. No. Whatever God requireth of any Man may be done, without neglecting his worldly Business.",102,
"Yn Laa ayns shaght t’ow er dy liettal veih laboraght ; jean ny ta currym ayd y yanoo er y laa shen, as shaghyn tammylt beg dy chooilley Voghrey as Fastyr, dy chur molley gys Jee, as dy yearree e vannaghtyn as eisht tra t’ow ec dty obber gagh laa, t’ow shirveish Jee cha firrinagh as cha shicker er y raad gys Niau, as t’ad syn t’ec nyn Badjeryn ; As foddee oo shoh y yanoo ooilley laghyn dty Vea.","One day in seven, you are forbid to Labour ; do what you are commanded on that Day, and spare a few Minutes every Morning and Evening to praise God, and to ask his Blessing ; and then when you are at your daily Labour, you are serving God as truly, and you are as certainly on the way to Heaven, as they who are at their Prayers. And this you may do all the Days of your Life.",103,
" Yn PHADJER."," The PRAYER.",103,
"ghrasoil ta dty lomarcan feeu jeh ooilley nyn Shirveish, Giall dy vod mad oo y hirveish as y yanoo booiagh cordail rish nyn Gurrym lesh ooilley nyn Gree as nyn Niart, dy vod mad booise as arrym y chur dhyt as tannaghtyn ayns Credjue as Aggle as Graih Yee gys jerrey nyn seihl, dy vod e shin y yanoo dy bragh bannit, trooid Yeesey Creest. Amen.","GRacious God, who alone art worthy  YEE  of all our Service, grant that we may serve and please Thee according to our Duty, with all our Heart and Strength, that we may give Thee Thanks, and do Thee Honour ; And that continuing in the Faith, and Fear, and Love of God, unto our Lives end, we may be made by Him, eternally Happy, thro’ Jesus Christ. Amen.",103,
Q. CRE ta dty Churrym gys dty Naboo ?,Q. WHat is thy Duty towards thy Neighbour ?,104,
"A. Ta my Churrim gys my Naboo dy chur graih da myr dou hene, as dy yanoo rish dy chooilley ghooinney myr ballym ad dy yanoo rhym. Dy chur graih, ooashley as kemmyrk da m’Ayr as da my Voir.","A. My Duty towards my Neighbour, is to Love him as my self, and to do unto all Men, as I would they should do unto me. To Love, Honour, and Succour my Father and Mother.",104,
"Dy chur ooashley as bialys da’n Ree as da ooilley ny ta er ny choyrt ayns prooar1 fo. Dy m’injilagh hene gys ooilley my Chiannoortyn, Firynsee, Bochyllyn Spyrydoil as Maishteryn. Dy m’ymmyrkey hene dy injil as dy byallagh gys dagh annane Share ny mee. Gyn aggair y yanoo da ghooinney erbee liorish goo ny janoo. Dy ve firrinagh as jeeragh ayns ooilley my ghellal.","To Honour and Obey the King, and all that are put in Authority under him. To submit my self to all my Governours, Teachers, Spiritual Pastours and Masters. To order my self lowly and reverently to all my Betters.",104,
"Gyn goanlys ny myskit y reall ayns my chree. Dy reall my lau-yn veih myngyraght as geid, as my hengey veih drough ghoan, breaghyn2 as scammyltyn. Dy reall [101] my my chorp3 fo smaght, sheeltys as glennid. Gyn Saynt ny aigney y choyrt da cooid ghooinney erbee, agh dy ynsagh as dy laboraght dy firrinagh dy gheddyn my veaghey hene as dy chooilleeney my Churrym ayns y stayd shen dy Vea, huggey schuid-save lesh Jee ve er n’eamagh orrym.","To hurt no body by Word or Deed. To be true and just in all my Dealings. To bear no malice, nor hatred in my Heart. To keep my Hands from picking and stealing, and my Tongue from evil speaking, lying, and slandering. To keep my Body in Temperance, Soberness, and Chastity, not to covet or desire other Mens Goods ; but to learn and labour truly to get my own Living, and to do my Duty in that state of Life, unto which it shall please God to call me.",104,
"Q. Nagh vel eh dy liooar, shin dy chur graih da Jee as dy ghoal aggle roish as dy chur ooashley da ?","Q. Is it not sufficient that we love, and fear, and honour God ?",105,
"A. Cha vel. Fakyn dy vel y Sarey shoh ain veih Jee ; Quoi erbee shynney leesh1 Jee, shynney lesh y Vraar myrgeddyn ; as shen-y-fa eshyn ta gra dy nynney lesh Jee as feoh echey er e Vraar, te ny vreagyrey. Cha vel graih echey er Jee, cha moo ta graih ec Jee ersyn.","A. It is not. For we have this Commandment from God, That he who loveth God, love his Brother also ; and therefore, he that saith he loveth God, and hateth his Brother, is a Liar ; He neither loveth God, nor doth God love him.",105,
Q. Quoi my Naboo as my Vraar ?,Q. Who is my Neighbour and Brother ?,105,
A. Dy chooilley annane ta feeu jeh dty ghraih ; Son ta Jee er hoilshagh shin ooilley dy ve Braaraghyn dy vod mad gynsagh dy ghoal boggey yn derrey yeh ayns maynrys y jeh elley as ve trimshagh yn derrey yeh son surranse y jeh elley.,"A. Every Person who is capable of your Love. For God hath declared us all to be Brethren, that we may learn to rejoice in one anothers Happiness, and be concerned at the Sufferings of each other.",105,
"Dy vod mad feasley y yanoo orroo ayns nyn veme, ve arloo dy chooney lieu ayns nyn Seaghyn as kinjagh smooinaght y chooid share jeh ny t’ad dy ghra as dy yanoo.","That we may relieve their Wants, be ready to help their Misfortunes, and always think the best of what they say or do.",105,
Liorish shoh bee mad shicker jeh foar Yee as yow mad leid ny aghtyn mie as nee nyn nianoo arloo son Niau.,"By which we shall secure the Favour of God, and get such Dispositions as may fit us for Heaven.",105,
"[102] As ayns y tra, ta ec y dooinney sniau-ynsit raad dy immeeaght ayn, corrym rish e hushtey.","And in the mean time, the most unlearned Person hath a Rule to walk by, suited to his Capacity.",105,
Q. Cur jee toiggal dou jeh shen ?,Q. I pray make me understand that.,105,
