Manx,English,Page,Notes
"A. Baase gys peccah as Bea noa ayns craueeaght, son ga va shin liorish dooghys er nyn mreh ayns peccah as nyn Gloan dy chorree ta shin liorish shoh jeant nyn Gloan dy Ghrayse.","A. A Death unto Sin, and a New Birth unto Righteousness : for being by Nature born in Sin, and the Children of Wrath, we are thereby made the Children of Grace.",126,
[125] Q. Cre ta er ny hirrey er Persoonyn ta dy ve er ny Mashtey ?,Q. What is required of Persons to be Baptised ?,126,
"A. Arrys, liorish ta’d tregeil peccah, as Credjue, liorish ta’d credjal Gialdynyn Yee jeant daue ayns y Sacrament shen.","A. Repentance, whereby they forsake Sin ; And Faith, whereby they stedfastly believe the Promises of God, made to them in that Sacrament.",126,
"Q. Cre’n fa eisht ta Ooikanyn er ny Mashtey, fakin nagh vod ad kyndagh rish nyn Agid adsyn y chooilleeney ?","Q. Why then are Infants Baptised, when by reason of their tender Age, they cannot perform them ?",126,
"[ 118 ] A. Son dy vel ad gialdyn ad ny neesht liorish nyn Raanteenyn yn gialdyn cheddyn, tra hig ad gys eash, ta’d hene kainlt dy chooilleeney.","A. Because they promise them both by their Sureties ; which Promise, when they come to age, themselves are bound to perform.",127,
Q. Rou Sacrament y vashtey oardit liorish Creest hene ?,Q. Was the Sacrament of Baptism ordained by Christ himself ?,127,
"A. Va ayns ny goan shoh, immee jee as ynsee jee dy chooilley ashoon bashtey ad ayns ennym yn Ayr, as y Vac, as y Spyrryd Noo.","A. It was in these words : Go ye, and teach all Nations, baptising them in the Name of the Father, and of the Son, and of the Holy Ghost.",127,
"Yn sarey cheddyn dreill ny Hostylyn hoilshee ad magh yn Sushtal, as chooilleen as chred y Goo, hie ad er bashtey liorish yn Oardagh casherick shoh, vishee ad yn Aglish dy chooilley laa, lesh leid as va dy ve er ny sauail.","Which Command the Apostles observed ; They preached the Gospel, and as many as believed the Word, them they baptised ; By this Sacrament, adding to the Church daily such as should be saved.",127,
"Ghou ad as laue dy rou eh ymmyrchagh adsyn y vashtey lesh Ushtey va dy jarroo er ny mannaghey lesh gioot y Spyrryd Noo ; Gynsagh dooin nagh vel [126] y sarey shoh ta Creest er chur dooin dy ve er ny liggey shaghey er aght erbee, raad oddys eh ve er ny reall.","Holding it Necessary to baptise with Water even Those that had received the Holy Ghost. Teaching us, that this Command of Christ, where it may be duly observed, is not to be neglected on any Account whatever.",127,
Q. Cre ta er ny yialdyn as er ny hickeragh dooin liorish y courey shoh er cheu mooie ayns Bashtey ?,Q. What is signified and assured to us by this outward Sign in Baptism ?,127,
"A. ’Naght myr ta’n corp er y niee lesh Ushtey, ayns ennym yn Ayr, y Mac, as y Spyrryd Noo, myr shen ta’n annym, ta er yn aght shoh er ny chasherick gys Jee, er ny ghlenney veih ooilley e pheccaghyn liorish fooill Chreest, ta’n Persoon ta bashtit jeant Oltey bio jeh Aglish Chreest, as liorish shen ta cairys echey ayns ymmodee dy yialdynyn mooar as evnyssagh.","A. That as the Body is washed by Water, in the name of the Father, Son and Holy Ghost, so is the Soul, Thus dedicated to God, cleansed from all its Sins, by the blood of Christ, the Person baptised is made a visible Member of Christ’s Church, and hath thereby a Right to many great and precious Promises.",127,
[ 119 ] Q. Cre ny Gialdynyn as Bannaghtyn ayndoo ta cairys ain liorish Bashtey ?,"Q. What are the Promises and Blessings, which by Baptism we have a Right to ?",128,
"A. Ga dy daink shin nyn Beccee stiagh ayns y teihl, ny yei nee Jee dellal rooin myr dy beagh shin fegooish peccah.","A. That though we were born in Sin, yet God will deal with us, as if we were innocent.",128,
"Ga nagh rou veg y chairys ain ayns Niau as maynrys liorish dooghys, Te nish cur cairys dooin ayndoo ny neeisht.","That having by Nature no Right to Heaven and Happiness, He doth now give us a Title to both.",128,
"As son nagh vod shin, shin hene y ymmyrkey as Jee y yanoo booiagh, te ayns Bashtey cur dooin e Spyrryd Noo dy chooney lhien, chammah dy chur tushtey dooin jeh nyn gurrym dy chooilleeney eh.","And because of our selves we are not able to walk and to please God, he doth in Baptism give us his Holy Spirit to enable us both to know and to do as our Duty.",128,
"As nee’n Spyrryd casherick cheddyn, mannagh der mad jummoose er shin y leeideil, as cooinee e lien gys jerrey nyn Mea, ver e aigney dooin dy ve crauee, cooinee e lien dy gheddyn barreeaght harrish nyn [127] Noidjin Spyrrydoil as ver e lesh shin gys Flaunyss.","Which Good Spirit, if we do not grieve him, will continue to guide and to assist us unto our Lives end, dispose us to Holiness, help us to overcome our spiritual Enemies, and bring us to Heaven.",128,
Q. Vel Cairys ec dy chooilley Phersoon ta lowal er ny Vashtey ayns ny Bannaghtyn shoh ?,"Q. Have all persons a Title to these Blessings, who have been rightly Baptised ?",128,
"A. Ta, Agh eisht foddee’n chairys shoh ve callit, mannagh vel kiarrail goit jeh, tra ta shin cheet gys Eash, ta shen dy ghra, mannagh ghooilleen1 oo ny hie er gialdyn er dy hon.","A. Yes ; but then this Title may be lost, if it is not looked after when you come to Years of Discretion ; that is, if you do not perform what was promised for you.",128,
"Q. Cre chon eisht nagh rou yn Bashtey ain er ny liggey shaghey, derrey harragh shin gys Eash keeal as tushtey ?","Q. Why then was not our Baptism deferred, until we came to Years of Discretion ?",128,
"A. Son dy rou eh reau er ny ghoal myr Bannaght mooar dy ve Casherick, ta shen dy ghra, dy ve er ny livrey seose gys Jee, cha lea as oddys eh ve, liorish e Spyrryd casherick dy voddagh e shin y yanoo aignagh gys Crauee-aght, as liorish e Ainlyn mie, ta er ny oardagh dy yanoo shirveish dauesyn vees Eiraghyn jeh Saualtys, shin y reall veih kialgyn drough Spyrrydyn.","A. Because it was ever esteemed a great Blessing to be sanctified, that is, dedicated to God as soon as might be, that by his good Spirit, he might dispose us to Holiness, and by his good Angels, which are appointed to minister to them, which shall be Heirs of Salvation, guard us from the Attempts of evil Spirits.",128,
"Shen-y-fa va Cloan ny Hewnyn er nyn ghoal stiagh ayns Conaant yn houghtoo laa jeh nyn Eash ; As ta Yeesey Creest gra, dy nee jeh leid oc shoh ta’n Reereeaght, ta shen dy ghra, Aglish Yee.","Therefore were Children of the Jews received into Covenant at eight Days old ; and Jesus Christ saith, That of such is the Kingdom, that is, the Church of God.",129,
"As shen-y-fa ta Cloan Creesteenyn Bashtit, son dy vel ny gialdynyn jeant dauesyn chammah as da nyn Ayraghyn as Moiraghyn ; as te lesh resoon mie er ny smooinaght tra hig ad gys tushtey jeh ny vondeishyn ayndoo ta cairys oc, dy jeagh ad nyn lurg as nee ad streeue dy gheddyn ad.","And therefore are Children of Christian Parents Baptised, because the Promises are to them, as well as to their Parents ; and it is with good Reason supposed, that when they come to know what Privileges they have a Right to, they will look after, and strive to obtain them.",129,
"[128] Q. Fakin eisht dy vel mish er jeet gys Eash, cre shegin dou y yanoo dy ve shicker jeh ny Bannaghtyn shoh ?","Q. Since then I am come to Age, what must I do to be sure of these Blessings ?",129,
"A. Shegin dhyt streeue dy hoiggal as dy chooilleeney ny reddyn ymmyrchagh shen ta er ny chur myr currym er dy chooilley annane, my vel ad er nyn mashtey, as va er ny yialdyn ayns dt’ennym. Ta’d shoh Arrys as Credjue, nyn vegooish cha jean Bashtey veg y vondeish dhyt.","A. You must endeavour to understand and perform those necessary things which are required of all Persons before they are baptised, and which were promised in your Name. These are Repentance, and Faith, without which Baptism will not profit you.",129,
Q. Cre gys ta Gialdyn Arrys dy my chiangley ?,Q. What doth the Promise of Repentance bind me to ?,129,
"A. T’ow kainlt dy hregeil dy chooilley ghrogh raad, Dy obbal dy chooilley Vee-chraueeys as saynt ny foalley, gyn ve cur rish peccah erbee er fys dhyt, agh Jee y hirveish gys dty hushtey as dty phooar share janoo ny Te dy harey as chea Veih ny Te cur raue noi. Son myr shen ta dy chooilley lianoo bialagh dy ymmyrkey e hene gys e Ayr ; as my t’ow uss dty lianoo da Jee as jercal rish y Foar echey, nee oo myr-geddyn cooinaghtyn dy negin dauesyn ta genmys ennym Chreest, ta shen, dy chooilley Chreestee firrinagh, chea vei drough yanoo.","A. You are bound to forsake all wicked Courses ; To deny all Ungodliness and Worldly Lusts ; Not to consent to Known Sin, but to serve God to the best of your Knowledge and Power, doing what he hath commanded, and avoiding what he hath forbidden : For so every dutiful Child behaves himself towards his Father ; and if you are a Child of God, and hope for his Favour, you will do so likewise ; Remembring, that he that Nameth the name of Christ, that is, every true Christian, must depart from Iniquity.",129,
"Q. Cre ta’n Credjue shen va mee er my vashtey huggey, as ta mee kainlt dy ghoal orrym pene ?","Q. What is that Faith into which I was Baptised, and which I am bound to take upon my self ?",130,
"A. T’ow kainlt dy chredjal Sushtal Yeesey Chreest, ayn ta soit shees ooilley aigney Yee, ymmyrchagh dy ve toiggit liorish dy chooilley ghooinney.","A. You are bound to Receive the Gospel of Jesus Christ, as that which containeth the whole Will of God necessary to be known by Men.",130,
"Ayns y Sushtal shen ta soit kiongoyrt rooin yn aght nee Jee nyn Anmeenyn y chosney, [129] ta shen, liorish Credjue ayns Yeesey Creest ; haink stiagh ayns y teihl dy hauail Peccee, hooar baase son nyn beccaghyn as jirree seose reeisht dyn Seyrey shin, as te er sarey shin dy eyrt er e chesmadyn, nagh[t] myr hooar eshyn baase as jirree e seose reeisht er nyn son ain, myr shen lishagh shin ta bashtit baase y gheddyn veih peccah, as girree seose reeisht gys cairys.","In which Gospel is made known to us the Way by which God will save us, that is, By Faith in Jesus Christ, who came into the World to save sinners ; Mar. 16. 16. Who died for our Sins, and rose again for our Justification ; 1 Tim. 1. 15. And hath commanded us to follow his Steps, that as he died and rose again for us, so should we that are baptised die from Sin, and rise again unto Righteousness.",130,
"My nee oo streeue dy yanoo shoh, eisht foddee oo dty laane treshteil as dty hickerys y choyrt ayns Yeesey Creest, dty varrant y chur gys gialdynyn Yee, dy vou leih peccaghyn, fooar as cooney, as foddee, shickerys mooar ve ayd, dy vel oo ayns stayd dy haualtys as ayns y raad gys Niau.","Which if you strive to do, then may you put your whole Trust and Confidence in Jesus Christ ; Depend upon God’s Promise of Pardon, Favour and Assistance, and may be well assured that you are in a State of Salvation, and in the Way to Heaven.",130,
"TA shin cur booise cree-oil dhyts, O Ayr Flaunyssagh, son dty Ghoo as dty Hacramentyn, guee ort dy vod ad cheet dy ve saase bree-oil dy Ghrayse dooin trooid credjue ayns Yeesey Creest. Giall ’naght myr ta shin er nyn ruggey reeisht liorish Ushtey as y Spyrryd Noo as jeant nyn Eiraghyn er dty Reereeaght, dy vod mad tannaghtyn ayns earroo dty harvaantyn crauee gys jerrey nyn Mea. Cur dooin Grayse nagh der mad dy bragh jummoose er dty Spyrryd Noo, liorish ta shin er nyn gasherickey, agh dy vod shin beaghey cordail rish nyn Gredjue Creestee, yn Bannaght vees dy bragh er-mayrn jeh’n Niee flaunyssagh shen y gheddyn, as dy vod mad cheet gys y Reereeaght dy bragh farraghtyn t’ow er Yialdyn, trooid Creest nyn Jiarn. Amen.","WE do heartily thank Thee, O heavenly Father, for thy Word and Sacraments, beseeching thee, that they may become effectual Means of Grace to us, through Faith in Jesus Christ. Grant that as we have been born again by Water and the Holy Ghost, and made Heirs of thy Kingdom, we may continue in the Number of thy faithful Servants unto our Lives End. Give us Grace, that we may never grieve thy Holy Spirit, by which we are sanctified, but that walking answerable to our Christian Calling, we may enjoy the everlasting Benefit of that heavenly Washing, and may come to the Eternal Kingdom which thou hast promised, through Christ our Lord. Amen.",130,
Q. CRe’n fa va Sacrament Shibber y Chiarn er ny oardagh ?,Q. WHY was the Sacrament of the Lord’s Supper ordained ?,131,
A. Son cooinaghtyn kinjagh jeh Oural Baase Chreest as jeh ny Vondeishyn ta shin dy gheddyn liorish.,"For the continual Remembrance of the Sacrifice of the Death of Christ, and of the Benefits which we receive thereby.",131,
Q. Cre ta’n Courey ny’n Ayrn er cheu mooie jeh Shibber y Chiarn ?,Q. What is the Outward Part or Sign of the Lord’s Supper ?,131,
A. Arran as Feeyn ta’n Chiarn er chur sarey dy ve er ny ghoal.,A. Bread and Wine which the Lord hath commanded to be received.,131,
Q. Cre ta’n ayrn ny’n red er cheu stieh ?,"Q. What is the Inward Part, or thing signified ?",131,
A. Corp as Fooill Chreest ta dy jarroo as dy firrinagh goit as er ny ghoal liorish y Chloan chrauee ayns Shibber y Chiarn.,"A. The Body and Blood of Christ, which are verily, and indeed taken, and received by the Faithful in the Lord’s Supper.",131,
Q. Cre ny Vondeishyn ta shin dy gheddyn liorish ?,Q. What are the Benefits whereof we are Partakers thereby ?,131,
[ 123 ] A. Niartagh as ooraghey nyn Anmeenyn liorish Corp as Fooill Chreest myr ta nyn Gallinyn liorish yn Arran as y Feeyn.,"A. The strengthening and refreshing of our Souls, by the Body and Blood of Christ, as our Bodies are by the Bread and Wine.",132,
Q. Cre’n currym ta lie orroosyn ta cheet gys Shibber y Chiarn ?,Q. What is required of them who come to the Lord’s Supper ?,132,
"A. Dyn Deisht ad hene vel ad dy firrinagh goal [131] Arrys son nyn beccaghyn t’er ghol shaghey, dy shicker kiarail bea noa y leideil, Credjue bio ve oc ayns Myghynyn Yee, trooid Creest, lesh Cooinaghtyn booisal jeh e Vaase, as ve ayns giastylys rish dy chooilley ghooinney.","A. To examine themselves, whether they Repent them truly of their former Sins, stedfastly purposing to lead a new Life ; have a lively Faith in God’s Mercies, through Christ, with a thankful Remembrance of his Death, and to be in Charity with all Men.",132,
Q. Cre’n tra va Sacrament Shibber y Chiarn er ny ooardagh liorish Creest ?,Q. When was the Sacrament of the Lord’s Supper ordained by Christ ?,132,
"A. Yn oie cheddyn v’e er ny Vragh, tra ghou e Arran as lurg da booise y choyrt vrish e eh, as dooyrt e, Gou jee as ee jee, Shoh’n Corp ayms ta brisht er nyn son, shoh jean jee ayns cooinaghtyn jeems. Myr-geddyn ghou e yn Cappan lurg Shibber gra, yn Cappan shoh yn Chumney Noa ayns yn Ooill ayms, jean jee shoh cha mennick as iv-ys shiu eh ayns cooinaghtyn jeems. Son cha mennick as nee shieu gee jeh’n Arran shoh, as give jeh’n Cappan shoh, ta shiu soiagh magh Baase y Chiarn derrey hig e.","A. The same Night in which he was betrayed, when he took Bread, and having given thanks, He brake it, and said, Take, Eat, This is my Body which is broken for you, This do in Remembrance of me. After the same manner also, He took the Cup, when He had supped, saying, this Cup is the New Testament in my Blood, This do ye as oft as ye Drink it in Remembrance of me. For as oft as ye Eat this Bread, and Drink this Cup, ye do shew the Lord’s Death till he come. 1 Cor. 11. 23, &c.",132,
Q. Cre ta shin dy ynsagh veih ny ta’n Ostyl dy ghra ayns shoh ?,Q. What are we to learn from these Words of the Apostle ?,132,
A. Dy nee’n Currym ain dy reall seose cooinaghtyn kinjagh jeh Baase Chreest liorish ny lomarcan ta shin geddyn leih peccaghyn.,"A. That it is our Duty to keep up a continual Remembrance of the Death of Christ, whereby alone we obtain Remission of our Sins, Luke 22. 19.",132,
"Dy yanoo shoh ta shin dy heet cuidjaght ( cha mennick as ta Saggyrt Yee cur fys dooin ) dy hoilshagh magh e Vaase, liorish brishey Arran as Deartey magh Feeyn, as cur booise gys Jee son e Vac y choyrt dy ynsagh dooin nyn nutee as dy hurranse baase son nyn beccaghyn.","That to do this, we are to meet together, ( as often as God’s Minister giveth us notice ) to declare and represent His Death, by breaking Bread, and pouring out Wine, and giving Thanks to God, for sending his Son to teach us our Duty, and to die for our Sins.",132,
"[132] Dy vel shin dy Ee’n Arran shen as dy Iv yn Feeyn shen, ayns courey dy vel shin dy firrinagh kiarrail as goal y Chreesteeaght chasherick shoh er, dy hannaghtyn nyn Sharvaantyn firrinagh da Creest, liorish e aigney chooilleeney lesh ooilley nyn Booar.","That we are to eat that Bread, and drink that Wine, in token, that we seriously purpose, and take this Sacrament upon it, to continue Christ’s faithful Servants, by doing His Will to the best of our Power.",133,
"Liorish ooilley shoh ta shin goal rish nyn stayd hrimshagh peccoil, as nagh vel treshteil ain agh ayns toilchinys Chreest ; Agh dy vel shin credjal dy vel y Baase echyssyn, Oural as liasagh slaane, firrinagh as fondagh son peccaghyn y teihl ooilley.","By all which, we acknowledge our own sad and sinful Condition, and that we have no Hopes, but in the Merits of Christ ; But that we believe His Death to be a full, perfect, and sufficient Sacrifice, Oblation, and Satisfaction, for the Sins of the whole World.",133,
"Q. Cre ny vondeishyn oddys shin treshteil y gheddyn, liorish cooinaght er Baase Chreest er yn aght chrauee shoh ?","Q. What Benefits may we hope for, by Remembring the Death of Christ after this Religious Manner ?",133,
"A. Foddee shin treshteil as jercal son Pardoon son ooilley nyn beccaghyn, as grayse as niart dy yanoo nyn Nutee as maynrys er son dy bragh tra yow mad baase. As foddee mad cha firrinagh jercal son ny Bannaghtyn shoh as oddys mad treshteil son Niart as Gerjagh veih beaghey. Son Jee, nagh haghyn e Vac hene agh livrey e Seose e, er nyn son ooilley, cre’n aght nagh der e doonin1 myrgeddyn dy arryltagh dy chooilley nee marish ?","A. We may expect and depend upon the Pardon of all our Sins, Rom. 5. 10. and Grace and Strength to do our Duty, and eternal Happiness when we die. And we may as certainly expect these Benefits, as we can hope for Strength and Refreshment from Food. For God, who spared not his own Son, but delivered him up for us all, how shall he not with him also freely give us all things ? Rom. 8. 32.",133,
Q. Vel ooilley adsyn ta gol gys Board y Chiarn geddyn ny Bannaghtyn shoh ?,Q. Do all that go to the Lord’s Table find there these Benefits ?,133,
"A. Cha vel, agh adsyn ny lomarcan ta goal y Chreesteeaght dy feeu.",A. No. But they only who receive this Sacrament worthily.,133,
[ 125 ] Q. Cre’n aght shegin dooin shin hene y yanoo arloo dy ghoal eh dy feeu ?,Q. How must we prepare our selves to receive it worthily ?,134,
"A. Ta’n Aglish, ta geyrt er Sambyl ny Hostylyn cur dhyt y choyrle yare ashagh shoh. Shegin dhyt oo hene y eisht my chion dt’arrys, dty chredjue as dty Yiastylys.","A. The Church, following the Apostles Rule, giveth you this short and plain Direction. You must examine your self, concerning your Repentance, your Faith, and your Charity.",134,
[133] Q. Cre’n aght nee mad shin hene y eisht my chion nyn Arrys ?,Q. How must we examine our selves concerning our Repentance ?,134,
"A. Shegin dhyt hoshiaght dty Chree y eisht dy yeaghyn vel tushtey ayd cre’n Creture peccoil, fegooish Cooney as tolchin corree Yee, oo ; Son eisht hee oo cre’n feme ta’d1 er, as cre’n bannaght ta liorish Saualtagh, as gys shen cha vaik oo. Son cha vel feme ocsyn ta slane er Lhee agh ocsyn ta ching.","A. You must first examine your Heart, whether you know what a Sinful, Helpless Creature you are, and liable to the Wrath of God ; for then you will see the Necessity and the Blessing of a Redeemer. And not till then ; Because, they that be whole need not a Physician, but they that be sick.",134,
"Eisht jeagh jean y Gaue mooar t’ow ayn aigney chur aynyd, dy smooinaght dy dowin er dty raadjin, dy ghoal rish dty pheccaghyn gys Jee, dy hoiagh kiongoyrt rish dt’ ymmyrch, as dty yearree, son myghyn ; as dy gaue2 er myr son dty vioys, dy leih dhyt dty pheccaghyn. Shoh’n Currym t’ort, as nee-oo shoh, my chooinys oo dy nee Leagh peccah Baase, dy jarroo Baase dy bragh farraghtyn, raad nagh vel Arrys goit er y hon.","Then see whether the great Danger you are in, will dispose you to consider your Ways, to confess your Sins to God, to lay before him your Want and your Desire of Mercy, and to beseech Him, as for your Life, to pardon you. This is what is required of you, and this you will do, if you remember That the Wages of Sin is Death, Rom. 6. 23. even Death eternal, where it is not Repented of.",134,
"Shegin dhyt er-y-fa shoh, ayns yn ynyd stierree oo hene y eisht vel oo goal as laue dty Vea y liasagh son y tra ta ry heet, dy firrinagh kiarrail Bea noa y leeideil as Mess y ymmyrkey cooie gys Arrys.","You must therefore in the last place, examin your self whether you Resolve to amend your Ways for the time to come, stedfastly purposing to lead a New Life, And to bring forth Fruits meet for Repentance, Matth. 3. 8.",134,
Q. Cre’n aght shegin dou mee hene y eisht my chion my Chredjue ?,Q. How must I examin my self concerning my Faith ?,134,
"A. Shegin dhyt oo hene y eisht vel oo dy jarroo credjal y Sushtal, dy vel Creest ayns Niau as liorish toilchinys e vaase janoo accan er nyn son. Dy bee Jee er y ghraih echyssyn coardit rish dagh peccagh arryssagh. Dy saue e ad veih Baase dy bragh beayn as dy der e Daue Bea vees dy bragh er mayrn.","A. You must consider whether you do indeed Believe the Gospel ; that Christ is in Heaven, and by the Merits of his Death making Intercession for us, Heb. 7. 24. That God for his Sake will be Reconciled to all Repenting Sinners, Rom. 5. 10. That he will save them from Death Eternal, and give them Everlasting Life.",134,
"My chredys oo ny reddyn shoh, as my ghoys oo ort dy veaghey gol rish fer ta janoo shoh gyn jeaghyn eddyr er dt’ obbraghyn mie hene agh er [134] myghyn Yee, eisht ta dty Chredjue leid as nee oo y hauail.","If you believe these things, and resolve to Live like one who doth so, Never looking upon your own Works, but upon the Mercy of God in Jesus Christ, giving hearty Thanks to God for his Death, then is your Faith such as will save you.",135,
Q. Cre’n aght nee’m mee hene y eisht my chion my Yiastylys ?,Q. How must I examin my self concerning my Charity ?,135,
"A. Shegin dhyt dty Chree y eisht vel leid yn aigney mie ayd gys dy chooilley ghooinney, as ta cooie gys Braraghyn ; Son ta shin oilley jeh yn chynney, Gee jeh’n yn arran, Lishagh shin er-y-fa shen ve jeh’n yn aigney as jeh’n yn annym, arloo dy chur Graih, dy chooney as dy ghoal Padjer yn derrey yeh son y jeh elley.","A. You must examin your Heart, whether you have such a good Will towards all Men as becometh Brethren ; For we are all of one Family, Partakers of the same Bread ; we therefore ought to be of one Mind, and of one Soul, ready to Love, to Help, and to Pray for one another.",135,
"Vel oo booiagh liasagh y choyrt as leih y hirrey orroosyn ta er ghoal jummoose rish dty ghoo, ny dty yanoo ny daue-syn t’ow er yanoo aggair ?","Whether you are willing to give Satisfaction, and to ask Pardon of such as may have taken Offence at your Words or Actions, or have been injured by you.",135,
Vel oo arloo dy leih daue-syn t’er yanoo aggair dhyt myr t’ow jercal rish Leih son dty ghrogh yanoo hene veih Laueyn Yee ?,"Ready to forgive such as have injured you, as you expect Forgiveness of your Offences at God’s Hand.",135,
"Shoh ta Yeesey Creest er choyrt myr sarey daue-syn ooilley ta cheet dy hebbal ad hene ny nyn Badjeryn gys Jee, as eisht nee e soiagh jeh ny Ourallyn oc.","This is what Jesus Christ hath expressly required, Matth. 5. 23. of all such as come to offer themselves or their Prayers to God, and then he will accept their Sacrifice.",135,
"Q. Eisht dy jarroo foddee fer nagh vel ynsagh mooar echey, my te smooinaght dy mie as janoo ny oddys e, E Chreesteeaght y ghoal dy feeu ?","Q. Then even an unlearned Person who means well, and will do his best, may be a Worthy Communicant ?",135,
"A. Cha vel doot jeh. Va Shibber y Chiarn er ny Oardagh son vondeish dy chooilley cheint dy Leih, Bought as Berchagh, ynsit as gyn ynsagh, Labreenyn chammagh as Sleih seyrey. Son ayns beggan dy ocklyn.","A. There is no doubt of it. The Lord’s Supper was Ordained for the Benefit of all sorts of People, Poor and Rich, Ignorant and Learned, People of Business, as well as those that have Leisure. For in few Words.",135,
My ta dooinney tushtagh jeh e Pheccaghyn as e annoonid as trimshagh er nyn son.,"If a Man is sensible of his Sins and Weaknesses, and sorry for them.",136,
My Te gearree as kiarrail ayns e Chree dy reall Annaghyn Yee gys e hushtey as e Phooar share.,If he desires and purposes in his Heart to keep God’s Commandments to the Best of his Knowledge and Power.,136,
"[135] As treshteil ayns Jee son grayse as cooney, gol gys Shibber y Chiarn, dyn veddyn ad ; Gou-ee leid y Persoon shoh e Chreesteeaght gys e gherjagh mooar nagh bee dy bragh ec kion.","And, trusting in God for Grace and Assistance, goeth to the Lord’s Supper to obtain them ; Such a Person will receive that Sacrament to his Great and Endless Comfort.",136,
"Q. Cre’n aght te taghyrt aisht1 dy vel chooilleen Mee rooisagh2 jeh Currym cha eddrym as ashagh, as fooast cha ymmyrchagh as Gerjolagh ?","Q. How comes it then, that so many neglect a Duty so plain and easie, and yet so necessary and comfortable ?",136,
"A. Son dy vel ymmodee nagh vel smooinaght er nyn Anmeenyn, ny er seihl ry heet.","A. Because there are Many who think not of their Souls, or of a World to come.",136,
